_id,cate,clink,ilink,info,loc,name,point,rand
ObjectId(5d248a2b7a10db99e1b994cf),剧情/爱情/战争,https://img3.doubanio.com/view/photo/s_ratio_poster/public/p2507572275.jpg,https://movie.douban.com/subject/6874741/,"    如果提前了解了你所要面对的人生，你是否还会有勇气前来？吴岭澜、沈光耀、王敏佳、陈鹏、张果果，几个年轻人满怀诸多渴望，在四个非同凡响的时空中一路前行。    吴岭澜（陈楚生饰），出发时意气风发，却很快在途中迷失了方向。沈光耀（王力宏饰），自愿参与了最残酷的战争，他一直在努力去做那些令他害怕，但重要的事。王敏佳（章子怡饰）最初的错误，只是为了虚荣撒了一个小谎；最初的烦恼，只是在两个优秀的男人中选择一个。但命运，却把她拖入被众人唾骂的深渊。陈鹏（黄晓明饰）把爱情摆在了理想前面，但爱情却没有把他摆在前面。他说，“我有人要照顾”，纵然这意味着与所有人作对，意味着要和她一起被放逐千里。张果果（张震饰），身处尔虞我诈的职场，“赢”是他的习惯。为了赢，他总是见招拆招，先发制人。而有一天，他却面临了一个比“赢”更重要的选择。这几个年轻人，在最好的年纪迎来了最残酷的...",中国大陆,无问西东,7.6,100
ObjectId(5d248a2b7a10db99e1b994d1),动作/科幻/惊悚/冒险,https://img1.doubanio.com/view/photo/s_ratio_poster/public/p725871968.jpg,https://movie.douban.com/subject/1432146/,"    斯塔克军火公司是美军在全球范围内第一大军火供应商，其新任掌门人托尼•斯塔克（小罗伯特·唐尼RobertDowneyJr.饰）风流倜傥，天资聪颖。他与公司元老俄巴迪亚•斯坦（杰夫·布里吉斯JeffBridges饰）合作无间，共同将斯塔克公司的业务推向顶峰。现实生活中的托尼热衷收集名贵跑车，搞点儿发明创造，当然露水姻缘更不可少。所幸他身边有维吉尼亚•波茨（格温妮斯·帕特洛GwynethPaltrow饰）这样的好助手细心打理一切，才让他能自由自在过着贵公子的生活。    在前往中东为军方展示新型武器的途中，托尼一众遭到恐怖分子袭击。他被弹片击中险些丧命，在英森博士的帮助下，托尼体内移植了一颗核动力的人工心脏。恐怖分子要求托尼制造强大的杀伤性武器，他和英森虚与委蛇，暗中制造了一套由聚变能源驱动的钢铁盔甲。穿上盔甲托尼大闹恐怖分子的基地，回到美...",美国,钢铁侠,8.2,101
ObjectId(5d248a2b7a10db99e1b994d3),剧情/悬疑/奇幻/古装,https://img1.doubanio.com/view/photo/s_ratio_poster/public/p2530249558.jpg,https://movie.douban.com/subject/5350027/,故事发生在盛唐时期的长安城，白乐天（黄轩饰）本是朝廷要官，却为了收集写诗的素材而甘愿被贬为起居郎。长安城内连连发生离奇的死亡事件，就连当今圣上也难逃厄运离奇身亡，这一切都和一只神出鬼没的妖猫有关。日本僧人空海（染谷将太饰）本为了替皇帝解咒远渡重洋而来，却和白乐天意气相投，两人决心携手调查案件真相。    一首如怨如诉的《清平调》表明，妖猫作祟和三十年前倾国倾城的杨贵妃（张榕容饰）之死有着千丝万缕的关联，追寻着曾经迷恋杨贵妃的阿部仲麻吕（阿部宽饰）所留下的日记，白乐天和空海一同见证了大唐曾经的荣光，亦揭开了当年隐瞒至今的阴谋。,中国大陆/日本,妖猫传,6.9,102
ObjectId(5d248a2b7a10db99e1b994d5),动画/歌舞/冒险,https://img1.doubanio.com/view/photo/s_ratio_poster/public/p2277799019.jpg,https://movie.douban.com/subject/1301753/,辛巴是狮子王国的小王子，他的父亲穆法沙是一个威严的国王。然而叔叔刀疤却对穆法沙的王位觊觎已久。    要想坐上王位宝座，刀疤必须除去小王子。于是，刀疤利用种种借口让辛巴外出，然后伺机大开杀戒，无奈被穆法沙即时来救。在反复的算计下，穆法沙惨死在刀疤手下，刀疤别有用心的劝辛巴离开，一方面派人将他赶尽杀绝。    辛巴逃亡中遇到了机智的丁满和善良的彭彭，他们抚养辛巴长成雄壮的大狮子，鼓励他回去森林复国。在接下来一场复国救民的斗争中，辛巴真正长成一个坚强的男子汉，领会了责任的真谛。,美国,狮子王,9.0,103
ObjectId(5d248a2b7a10db99e1b994d7),剧情/历史/战争,https://img3.doubanio.com/view/photo/s_ratio_poster/public/p2507227732.jpg,https://movie.douban.com/subject/26862829/,故事发生在上世纪七十年代，寄人篱下的少女何小萍（苗苗饰）经过重重试炼终于加入了梦寐以求的文工团，哪知道这里和她曾经待过的那些地方并无不同，她依然得忍受遭人唾弃和欺侮的生活。唯一给过她温暖的，是刘峰（黄轩饰），不仅仅是对何小萍，被称为“活雷锋”的刘峰把自己的爱情和温暖无私的奉献给每一个人。    实际上，刘峰一直爱慕着美丽活泼的林丁丁（杨采钰饰），当他选择将这份感情勇敢的表达出来时，却让自己的人生走向了完全不同的方向。战争开始了，刘峰、何小萍和萧穗子前赴后继的走上了前线，在枪弹和炮火之中，每一个人都在用生命和热血绽放着属于他们的芳华。,中国大陆,芳华,7.6,104
ObjectId(5d248a2b7a10db99e1b994d9),喜剧/动作/科幻/动画/冒险,https://img1.doubanio.com/view/photo/s_ratio_poster/public/p2224568669.jpg,https://movie.douban.com/subject/11026735/,未来世界的超级都市旧京山（SanFransokyo），热爱发明创造的天才少年小宏，在哥哥泰迪的鼓励下参加了罗伯特·卡拉汉教授主持的理工学院机器人专业的入学大赛。他凭借神奇的微型磁力机器人赢得观众、参赛者以及考官的一致好评，谁知突如其来的灾难却将小宏的梦想和人生毁于一旦。大火烧毁了展示会场，而哥哥为了救出受困的卡拉汉教授命丧火场。身心饱受创伤的小宏闭门不出，哥哥生前留下的治疗型机器人大白则成为安慰他的唯一伙伴。原以为微型机器人也毁于火灾，谁知小宏和大白竟意外发现有人在某座废弃工厂内大批量地生产他的发明。    稍后哥哥的朋友们弗雷德等人也加入进来，他们穿上小宏发明的超级战士战斗装备，和怀有险恶阴谋的神秘对手展开较量……,美国,超能陆战队,8.6,105
ObjectId(5d248a2b7a10db99e1b994db),喜剧/动画/奇幻/冒险,https://img1.doubanio.com/view/photo/s_ratio_poster/public/p2555538168.jpg,https://movie.douban.com/subject/26835471/,好莱坞真人电影《大侦探皮卡丘》（暂译）讲述了蒂姆·古德曼（贾斯提·史密斯饰）为寻找下落不明的父亲来到莱姆市，意外与父亲的前宝可梦搭档大侦探皮卡丘相遇，并惊讶地发现自己是唯一能听懂皮卡丘说话的人类，他们决定组队踏上揭开真相的刺激冒险之路。探案过程中他们邂逅了各式各样的宝可梦，并意外发现了一个足以毁灭整个宝可梦宇宙的惊天阴谋。该电影改编自任天堂3DS同名游戏，由罗伯·莱特曼导演，瑞安·雷诺兹为大侦探皮卡丘配音，贾斯提斯·史密斯、凯瑟琳·纽顿等主演。,美国/日本,大侦探皮卡丘,6.6,106
ObjectId(5d248a2b7a10db99e1b994dd),剧情/喜剧/动作,https://img3.doubanio.com/view/photo/s_ratio_poster/public/p2526297221.jpg,https://movie.douban.com/subject/26366496/,七七事变前夕，华裔青年小亨德勒（彭于晏饰）从美国远赴重洋，回到阔别十数年之久的北平从医。然而他真正的名字叫李天然，十三岁那年曾亲眼目睹师父一家遭师兄朱潜龙（廖凡饰）和日本人根本一郎（泽田谦也饰）灭门。侥幸逃生的天然被美国人亨德勒医生送往大洋彼岸，接受了极其严苛的训练，而今他怀着绝密的任务踏上故土。亨德勒父子租住神秘男子蓝青峰（姜文饰）的宅子，蓝是当年辛亥革命的参与者，他与现为警察局长的朱潜龙过从甚密，却又以杀死李天然为筹码，暗中怂恿朱除掉根本一郎。复仇心切的李天然寻找到了仇人，而亨德勒医生则全力阻止养子冒险。在这一过程中，交际花唐凤仪（许晴饰）与裁缝关巧红（周韵饰）也卷入了男人的勾心斗角的漩涡里。直到七七事变爆发，所有的矛盾迎来了决断的时刻……    本片根据张北海的小说《侠隐》改编。,中国大陆,邪不压正,7.0,107
ObjectId(5d248a2b7a10db99e1b994df),喜剧/爱情/奇幻,https://img1.doubanio.com/view/photo/s_ratio_poster/public/p2520331478.jpg,https://movie.douban.com/subject/27133303/,生活在2018年的大龄女青年谷小焦（佟丽娅饰），梦想能够嫁一个能买得起她幼时豪宅的有钱人，却屡屡受挫，只能蜗居在一栋老居民楼里。生活在1999年的陆鸣（雷佳音饰）手握着自己设计的宏伟蓝图，却始终找不到投资人，同时也面临重大的事业危机。奇怪的时刻来临了，失意的两个人回到家中居然发生了惊人的一幕，同一扇门关上后居然是两个时空的交汇点，两个不同时空的人相遇了，为了拯救自己的未来，两人共商大计，开启了幻想一夜暴富的一系列措施，引发了啼笑皆非的连锁反应。而他们不知道的是，两个时空的重叠是人为的操控，他们每走一步都会引发不可预知的结果，更要命的事，本来只是视对方为赚钱拍档的两人引发了爱的火花……,中国大陆,超时空同居,6.8,108
ObjectId(5d248a2b7a10db99e1b994e1),剧情/喜剧,https://img3.doubanio.com/view/photo/s_ratio_poster/public/p2393044761.jpg,https://movie.douban.com/subject/25921812/,一群“品行不端”却怀揣教育梦想的大学教师，从大城市来到偏远乡村开办了一所小学校。学校待遇惨淡、生活艰苦，但老师们都自得其乐，每天嘻嘻哈哈打成一片。然而教育部特派员要来突击检查的消息打破了安宁，因为学校有一位“驴得水老师”隐藏着不可告人的秘密。就在所有人都担心丑事即将败露的时候，一个神奇天才的出现拯救了大家，然而谁能料到真正的麻烦才刚刚开始……,中国大陆,驴得水,8.3,109
ObjectId(5d248a2b7a10db99e1b994e3),剧情/家庭/犯罪,https://img3.doubanio.com/view/photo/s_ratio_poster/public/p2530599636.jpg,null,东京的都市丛林中央，残存着一栋古旧寒酸的老房子，这里局促地生活着柴田一家五口人。在工地当临时工的男人阿治（LilyFranky饰）经常带着儿子祥太（城桧吏饰）到超市盗窃生活用品，这一天，他们回家路上遇到了独自待在户外的四岁女孩由里（佐佐木美结饰）。妻子信代（安藤樱饰）起初极力主张将女孩送回父母身边，但当看到女孩原生家庭的状况时又心生恻隐。原本柴田家就靠着老奶奶初枝（树木希林饰）的养老金度日，而今多了一口人，自然更艰辛了几分。包括信代的妹妹亚纪（松冈茉优饰）在内，虽然一家人游走在贫困和违法的边缘，但笃深的羁绊将他们紧紧联系在一起，使他们的心不会随着冰冷的都市而寒冷下去……        本片荣获第71届戛纳电影节金棕榈,日本,小偷家族,8.7,110
ObjectId(5d248a2b7a10db99e1b994e5),剧情/爱情,https://img3.doubanio.com/view/photo/s_ratio_poster/public/p2378140502.jpg,https://movie.douban.com/subject/27622447/,七月（马思纯饰）和安生（周冬雨饰）的第一次相识在十三岁，她们一个是特立独行飞扬跋扈的“野孩子”，一个是单纯温婉循规蹈矩的“乖乖女”，从那一年开始，七月和安生几乎形影不离，她是她的光，她是她的影子，直到某一天，一位名为苏家明（李程彬饰）的少年出现在了七月的身边，七月恋爱了。    安生决定前往北京讨生活，临别之前，七月意外的发现苏家明贴身带着的玉佩，竟然出现在了安生的衣领里。安生走了，七月和苏家明的恋情持续着，他们考入了同一所大学，约定一毕业就结婚。可是，事情并没有像七月所想象的那样发展，而她和苏家明之间的关系，亦因为安生的归来而产生了新的变数。,中国大陆/香港,七月与安生,7.6,111
ObjectId(5d248a2b7a10db99e1b994e7),喜剧/科幻,https://img1.doubanio.com/view/photo/s_ratio_poster/public/p2541901817.jpg,https://movie.douban.com/subject/25827935/,号称银河系最先进的外星文明试图和地球建交，谁知一连串的误会导致意外发生。外星使者的飞船坠入大气层，最终摔在了中国某市的世界公园中。靠耍猴戏为生的耿浩（黄渤饰）和酒贩子好友大飞（沈腾饰）把受伤的外星人错认为来自南美洲的猴子，在自家猴子受伤的情况下，耿浩开始训练起这个他口中的“刚果骚骚猴”来了。由于失去了超能力加成设备，外星人的本事无法施展，只能任由这两个傻乎乎的地球人打骂操练。尽管如此，他仍试图夺回自己的装备。另一方面，之前与外星人交流失败的超级大国根据外星人留下的信息，穿梭世界各地寻找外星使者。地球的命运朝着不可预测的方向发展……    本片创意来自刘慈欣的科幻小说《乡村教师》。,中国大陆,疯狂的外星人,6.4,112
ObjectId(5d248a2b7a10db99e1b994e9),喜剧/奇幻,https://img3.doubanio.com/view/photo/s_ratio_poster/public/p2531080870.jpg,https://movie.douban.com/subject/25986662/,拥有一个每天耍贱整蛊妹妹、毫无家庭感的哥哥是一种什么感受？油炸还是蒸锅？时秒只希望哥哥时分彻底消失！连珍贵的生日愿望都是“快把我哥带走”。不料愿望成真，哥哥变成闺蜜妙妙的哥哥，时秒同情妙妙的同时心里暗爽摆脱“大魔王”！变成独生女的时秒感觉生活无限美好，但却发现时分除了整天和好基友甄开心、万岁插科打诨、整蛊妹妹妙妙之外，还隐藏着不为人知的秘密……,中国大陆,快把我哥带走,6.8,113
ObjectId(5d248a2b7a10db99e1b994eb),剧情/动作/犯罪,https://img3.doubanio.com/view/photo/s_ratio_poster/public/p2380677316.jpg,https://movie.douban.com/subject/30122633/,金三角湄公河上，一处被称为“鬼门关”的河段，两艘来自中国的商船遭到不明身份之人的枪击袭击。未过多久，泰国军方召开新闻发布会，指责中国商船贩卖毒品。虽然发布会宣称船员全部逃亡，但是十三具遭受残忍杀害的中国船员尸体很快被人发现。这起胆大妄为的案件令中国警方大为震惊，云南省缉毒总队队长高刚（张涵予饰）受命带特别行动小组前往泰国，并与情报员方新武（彭于晏饰）合作接洽。根据现有资料显示，这件案子由盘踞在金三角的大毒枭糯卡所为。糯卡贪婪残忍，胆大包天，是湄公河流域上一颗惊扰运输安全的毒瘤。为了将这个恶棍绳之于法，中国、老挝、缅甸开展了三国联合巡逻，集中对糯卡的制毒窝点进行扫荡。而高刚等人也深入最危险境地，与丧失人性的贩毒分子进行惨烈对决……    本片根据真实事件改编。,中国大陆/香港,湄公河行动,8.0,114
ObjectId(5d248a2b7a10db99e1b994ed),剧情/喜剧/爱情,https://img3.doubanio.com/view/photo/s_ratio_poster/public/p2189265085.jpg,https://movie.douban.com/subject/25815034/,欧洲某国的安妮公主（奥黛丽·赫本AudreyHepburn饰）到访罗马，国务烦身，但她又厌倦繁文缛节。一天晚上，身心俱疲的她偷偷来到民间欣赏夜景，巧遇报社记者乔（格里高利·派克GregoryPeck饰）。二人把手同游，相当快乐。公主更是到乔的家中作客并在那过夜。    不料乔无意中发现了公主的真实身份，他决定炮制一个独家新闻，于是乔和朋友、摄影师欧文（埃迪·艾伯特EddieAlbert饰）一起带公主同游罗马，并且偷拍了公主的很多生活照。然而，在接下来与公主的相处中，乔不知不觉恋上了公主。为了保护公主的形象，乔只能忍痛抛弃功成名就的良机，将照片送予了公主。    安妮公主在经历了罗马一日假期后，反而体验了自己对国家的责任，毅然返回了大使馆，为了本身的责任而果断抛弃了爱情。,美国,罗马假日,9.0,115
ObjectId(5d248a2b7a10db99e1b994ef),剧情/情色/战争,https://img1.doubanio.com/view/photo/s_ratio_poster/public/p2441988159.jpg,https://movie.douban.com/subject/1293839/,"    当我还只是十三岁时，1941年春末的那一天，我初次见到了她那一天，墨索里尼向英法宣战，而我，得到了生命里的第一辆脚踏车。    她，撩著波浪状黑亮的秀发，穿著最时髦的短裙和丝袜，踏著充满情欲诱惑的高跟鞋，来到了西西里岛上宁静的阳光小镇。她的一举一动都引人瞩目、勾人遐想，她的一颦一笑都教男人心醉、女人羡妒。玛莲娜，像个女神一般，征服了这个海滨的天堂乐园。    年仅十三岁的雷纳多也不由自主地掉进了玛莲娜所掀起的漩涡之中，他不仅跟著其他年纪较大的青少年们一起骑著单车，穿梭在小镇的各个角落，搜寻著玛莲娜的诱人丰姿与万种风情，还悄悄地成为她不知情的小跟班，如影随形地跟监、窥视她的生活。她摇曳的倩影、她聆听的音乐、她贴身的衣物都成为这个被荷尔蒙淹没的少年，最真实、最美好的情欲幻想。    然而，透过雷纳多的眼，我们也看到了玛莲娜掉进了越来越黑暗的处境之中，她变成了寡妇，而在镇民...",意大利/美国,西西里的美丽传说,8.8,116
ObjectId(5d248a2b7a10db99e1b994f1),剧情/历史/战争,https://img3.doubanio.com/view/photo/s_ratio_poster/public/p492406163.jpg,https://movie.douban.com/subject/1292402/,1939年，波兰在纳粹德国的统治下，党卫军对犹太人进行了隔离统治。德国商人奥斯卡·辛德勒（连姆·尼森LiamNeeson饰）来到德军统治下的克拉科夫，开设了一间搪瓷厂，生产军需用品。凭着出众的社交能力和大量的金钱，辛德勒和德军建立了良好的关系，他的工厂雇用犹太人工作，大发战争财。    1943年，克拉科夫的犹太人遭到了惨绝人寰的大屠杀，辛德勒目睹这一切，受到了极大的震撼，他贿赂军官，让自己的工厂成为集中营的附属劳役营，在那些疯狂屠杀的日子里，他的工厂也成为了犹太人的避难所。    1944年，德国战败前夕，屠杀犹太人的行动越发疯狂，辛德勒向德军军官开出了1200人的名单，倾家荡产买下了这些犹太人的生命。在那些暗无天日的岁月里，拯救一个人，就是拯救全世界。,美国,辛德勒的名单,9.5,117
ObjectId(5d248a2b7a10db99e1b994f3),动作/科幻/冒险,https://img3.doubanio.com/view/photo/s_ratio_poster/public/p2198455702.jpg,https://movie.douban.com/subject/1295124/,彼得·奎尔（克里斯·帕拉特ChrisPratt饰）是一名从小被劫持到外太空的地球人，在义父勇度（迈克尔·鲁克MichaelRooker饰）的培养下成了一个终极混混，自称“星爵”。一次行动中他偷了一块神秘球体，便成为了赏金猎人火箭浣熊（布莱德利·库珀BradleyCooper配音）、树人格鲁特（范·迪塞尔VinDiesel配音）的绑架目标，而神秘的卡魔拉（佐伊·索尔达娜ZoeSaldana饰）也对神秘球体势在必得。经过笑料百出的坎坷遭遇，星爵被迫和这三人，以及复仇心切的“毁灭者”德拉克斯（戴夫·巴蒂斯塔DaveBatista饰）组成小分队逃避“指控者”罗南（李·佩斯LeePace饰）的追杀。然而这个神秘球体拥有无穷的力量，小分队必须团结一致对付罗南，才有可能解救整个银河系，银河护卫队由此诞生。,美国/英国,银河护卫队,8.1,118
ObjectId(5d248a2b7a10db99e1b994f5),动画/奇幻/冒险,https://img3.doubanio.com/view/photo/s_ratio_poster/public/p2210954024.jpg,https://movie.douban.com/subject/7065154/,维京岛国的少年小嗝嗝（杰伊•巴鲁切尔JayBaruchel配音）是部落统领伟大的斯托里克（杰拉德·巴特勒GerardButler配音）的儿子，他非常想像自己的父亲一样亲手屠龙——这些飞龙是岛上维京人放牧羊群的主要天敌——但他每次出现在部落屠龙的战斗中都只给大家徒增烦恼。在一次对抗飞龙的战斗中，希卡普偷偷用射龙器击伤了一只最神秘的“夜之怒龙”，并背着族人放生、豢养，甚至驯服了这只龙，还给它起名“无牙”。希卡普的神秘行径引起了一同训练屠龙技巧的女孩阿斯特丽德（亚美莉卡·费雷拉AmericaFerrera配音）的怀疑。阿斯特丽德发现了希卡普的秘密，却同时被身骑“无牙”御风而飞的美妙体验所震撼。格雷决定在屠龙成人礼上向远征归来的斯托里克和族人讲明真相，说服大家放弃屠龙，却偏偏弄巧成拙，害得“无牙”被俘，一场更大的灾难就在眼前……,美国,驯龙高手,8.7,119
ObjectId(5d248a2b7a10db99e1b994f7),剧情/犯罪,https://img1.doubanio.com/view/photo/s_ratio_poster/public/p2292976849.jpg,https://movie.douban.com/subject/2353023/,老炮儿在北京话中，专指提笼遛鸟，无所事事的老混混儿。    六爷（冯小刚饰）就曾是“横行”老北京的老炮儿之一，如今过着悠闲自得的日子，却不想自己的儿子晓波（李易峰饰）被卷入了与“小爷”小飞（吴亦凡饰）的纠纷中。六爷试图出面摆平这起纠纷，并找来了昔日老友闷三儿（张涵予饰）、话匣子（许晴饰）、灯罩儿（刘桦饰）帮忙，却发现这个时代已经有了一群新的“话事人”，自己这个顽主的江湖地位已经动摇，并且以往固守的生活方式已经渐渐被时代所抛弃，廉颇老矣尚能饭否？,中国大陆,老炮儿,7.7,120
ObjectId(5d248a2b7a10db99e1b994f9),喜剧,https://img3.doubanio.com/view/photo/s_ratio_poster/public/p1793720172.jpg,https://movie.douban.com/subject/24751756/,商业成功人士徐朗（徐峥饰）用了五年时间发明了一种叫“油霸”的神奇产品——每次汽车加油只需加到三分之二，再滴入2滴“油霸”，油箱的汽油就会变成满满一箱。徐朗的同学，兼商业竞争对手高博（黄渤饰）想把这个发明一次性卖给法国人。但徐朗坚决不同意，他希望深入开发研究，把“油霸”发扬光大，得到更远的收益。两个人各抒己见，争论不休，一直无果。由于两人股份相同，唯有得到公司最大股东周扬的授权书，方可达到各自目的。当得知周扬在泰国后，徐朗立刻启程寻找。而高博获悉后将一枚跟踪器放在徐朗身上一起去了泰国。飞机上，徐朗遇到了王宝（王宝强饰），别有心机地想利用他来摆脱对手高博的追赶，可他不仅没甩掉王宝，还成了他的“贴身保姆”……    究竟徐朗和高博谁会最终拿到周扬的授权书？而三个各怀目的的人，又将带来一段如何爆笑的泰国神奇之旅？,中国大陆,人再囧途之泰囧,7.4,121
ObjectId(5d248a2b7a10db99e1b994fb),奇幻/冒险,https://img1.doubanio.com/view/photo/s_ratio_poster/public/p2538826177.jpg,https://movie.douban.com/subject/10574622/,"    虽然纽特（埃迪·雷德梅恩EddieRedmayne饰）协助美国魔法部将邪恶的黑巫师格林德沃（约翰尼·德普JohnnyDepp饰）捉拿归案，但最终格林德沃还是逃脱了禁锢，他来到了法国巴黎，一是为了集结信徒掀起革命，二是为了寻找同样藏匿在这里的克雷登斯（埃兹拉·米勒EzraMiller饰），寄生在克雷登斯身上的默默然是帮助格林德沃实现野心的不可或缺的道具。    格林德沃的潜逃在整个魔法世界里都掀起了轩然大波，一时间草木皆兵。邓布利多（裘德·洛JudeLaw饰）秘密的找到了纽特，希望他能够前往巴黎，先格林德沃一步找到克雷登斯。和纽特一起踏上巴黎之旅的，是麻鸡雅各布（丹·福格勒DanFogler饰），他此行的目的，是要找回先前因为吵架而来到巴黎投奔姐姐蒂娜（凯瑟琳·沃特森KatherineWaterston饰）的恋人奎妮（艾莉...",美国/英国,神奇动物：格林德沃之罪,7.1,122
