_id,cate,clink,ilink,info,loc,name,point,rand
ObjectId(5d248a2a7a10db99e1b99403),喜剧/动画/奇幻,https://img3.doubanio.com/view/photo/s_ratio_poster/public/p2557284230.jpg,https://movie.douban.com/subject/6850547/,《玩具总动员4》讲述：胡迪总是对自己身处这个世界的使命感到自信满满，他的首要任务永远都是要先照顾好自己的“孩子”——不管是老主人安迪还是新主人邦妮，但是当邦妮把她自制的、不情愿当玩具的Forky放进来后，胡迪将和他的新老朋友一起踏上一场公路冒险之旅，也让他明白作为一个玩具他所面对的“世界”会有多大。    胡迪、巴斯光年、翠丝、蛋头先生、蛋头太太、弹簧狗、猪排博士、抱抱龙、太空外星人等集体回归，第四部还有新玩具——Forky首度登场！Forky由TonyHale配音，是邦妮用一次性叉勺改造的手工“玩具”。玩具存在的目的是为了给孩子带来欢乐，但是手工改造的玩具呢？Forky坚信自己不是玩具，就是个叉勺，所以要努力逃离玩具的世界！,美国,玩具总动员4,8.8,0
ObjectId(5d248a2a7a10db99e1b99405),剧情/动画/奇幻,https://img1.doubanio.com/view/photo/s_ratio_poster/public/p2557573348.jpg,https://movie.douban.com/subject/1291561/,千寻和爸爸妈妈一同驱车前往新家，在郊外的小路上不慎进入了神秘的隧道——他们去到了另外一个诡异世界—一个中世纪的小镇。远处飘来食物的香味，爸爸妈妈大快朵颐，孰料之后变成了猪！这时小镇上渐渐来了许多样子古怪、半透明的人。    千寻仓皇逃出，一个叫小白的人救了他，喂了她阻止身体消失的药，并且告诉她怎样去找锅炉爷爷以及汤婆婆，而且必须获得一份工作才能不被魔法变成别的东西。    千寻在小白的帮助下幸运地获得了一份在浴池打杂的工作。渐渐她不再被那些怪模怪样的人吓倒，并从小玲那儿知道了小白是凶恶的汤婆婆的弟子。    一次，千寻发现小白被一群白色飞舞的纸人打伤，为了救受伤的小白，她用河神送给她的药丸驱出了小白身体内的封印以及守封印的小妖精，但小白还是没有醒过来。    为了救小白，千寻又踏上了她的冒险之旅。,日本,千与千寻,9.3,1
ObjectId(5d248a2a7a10db99e1b99407),剧情,https://img1.doubanio.com/view/photo/s_ratio_poster/public/p2555295759.jpg,https://movie.douban.com/subject/30170448/,法庭上，十二岁的男孩赞恩向法官状告他的亲生父母，原因是，他们给了他生命。是什么样的经历让一个孩子做出如此不可思议的举动？故事中，赞恩的父母在无力抚养和教育的状况下依然不停生育，作为家中的长子赞恩，弱小的肩膀承担了无数生活的重压。当妹妹被强行卖给商贩为妻时，赞恩愤怒离家，之后遇到一对没有合法身份的母子，相互扶持勉强生活。然而生活并没有眷顾赞恩，重重磨难迫使他做出了令人震惊的举动……,黎巴嫩/法国/美国,何以为家,9.0,2
ObjectId(5d248a2a7a10db99e1b99409),动作/科幻/冒险,https://img3.doubanio.com/view/photo/s_ratio_poster/public/p2332503406.jpg,https://movie.douban.com/subject/25820460/,美国队长史蒂夫·罗杰斯（克里斯·埃文斯ChrisEvans饰）带领着全新组建的复仇者联盟，继续维护世界和平。然而，一次执行任务时联盟成员不小心造成大量平民伤亡，从而激发政治压力，政府决定通过一套监管系统来管理和领导复仇者联盟。联盟内部因此分裂为两派：一方由史蒂夫·罗杰斯领导，他主张维护成员自由，在免受政府干扰的情况下保护世界；另一方则追随托尼·斯塔克（小罗伯特·唐尼RobertDowneyJr.饰），他令人意外地决定支持政府的监管和责任制体系。神秘莫测的巴基（塞巴斯蒂安·斯坦SebastianStan饰）似乎成为内战的关键人物……,美国,美国队长3,7.8,3
ObjectId(5d248a2a7a10db99e1b9940b),动作/奇幻/冒险,https://img3.doubanio.com/view/photo/s_ratio_poster/public/p2388501883.jpg,https://movie.douban.com/subject/3025375/,斯特兰奇博士（本尼迪克特·康伯巴奇BenedictCumberbatch饰）是一名外科手术医生，他拥有着高超的智商和精湛的技艺，是医院乃至整个医学界的传奇人物。某一日，斯特兰奇博士遭遇了一场可怕的车祸，尽管保住了双手，但这双手伤痕累累不住颤抖，这也就意味着，他再也不能拿起手术刀，站在无影灯下了。    斯特兰奇博士的生活就此失去了意义陷入了绝望之中，他决定远赴尼泊尔，寻找传说中能够治愈他双手的神秘力量。在尼泊尔，风尘仆仆的斯特兰奇博士拜入了神秘的古一法师（蒂尔达·斯文顿TildaSwinton饰）门下，成为了其弟子，与此同时，古一法师曾经的弟子卡西利亚斯（麦斯·米科尔森饰）亦在虎视眈眈，企图完成他获得永生的大业。,美国,奇异博士,7.6,4
ObjectId(5d248a2a7a10db99e1b9940d),动作/科幻/冒险,https://img3.doubanio.com/view/photo/s_ratio_poster/public/p2497756471.jpg,https://movie.douban.com/subject/24753477/,彼得帕克（汤姆·赫兰德TomHolland饰）在内战后受到了钢铁侠托尼斯塔克（小罗伯特·唐尼RobertDowneyJr.饰）的赏识，表面上，彼得进入托尼的公司成为了一名实习生，实际上，他和复仇者联盟的成员们一起接受了各种各样的训练。托尼虽然欣赏彼得的勇敢和正直，却并不认为他目前已经拥有加入复联的实力，他派出了特工哈皮（乔恩·费儒JonFavreau饰）暗中观察，这让十分想证明自己的彼得感到万分焦躁。    在对付两个银行劫匪的过程中，彼得发现劫匪们使用的是一种前所未见的新型武器，他孤身一人深入敌后顺藤摸瓜找到了幕后主使秃鹰（迈克尔·基顿MichaelKeaton饰），让他彼得没有想到的是，秃鹰竟然是他爱慕的女生利兹（劳拉·海瑞尔LauraHarrier饰）的父亲。,美国,蜘蛛侠：英雄归来,7.4,5
ObjectId(5d248a2a7a10db99e1b9940f),动作/科幻/奇幻/冒险,https://img3.doubanio.com/view/photo/s_ratio_poster/public/p2237747953.jpg,https://movie.douban.com/subject/10741834/,"    托尼·斯塔克（小罗伯特·唐尼RobertDowneyJr.饰）试图重启一个已经废弃的维和项目，不料该项目却成为危机导火索。世上最强大的超级英雄——钢铁侠、美国队长（克里斯·埃文斯ChrisEvans饰）、雷神（克里斯·海姆斯沃斯ChrisHemsworth饰）、绿巨人（马克·鲁弗洛MarkRuffalo饰）、黑寡妇（斯嘉丽·约翰逊ScarlettJohansson饰）和鹰眼（杰瑞米·雷纳JeremyRenner饰），不得不接受终极考验，拯救危在旦夕的地球。神秘反派奥创（詹姆斯·斯派德JamesSpader配音）逐渐崛起，超级英雄们必须重新集结，竭力阻止奥创实施人类灭绝计划。战斗中，复仇者联盟成员们还遇到了两个新人物——旺达·马克西莫夫（伊丽莎白·奥尔森ElizabethOlsen饰）和皮特罗·马克西莫...",美国,复仇者联盟2：奥创纪元,7.4,6
ObjectId(5d248a2a7a10db99e1b99411),动作/奇幻/冒险,https://img1.doubanio.com/view/photo/s_ratio_poster/public/p2159068249.jpg,https://movie.douban.com/subject/1866471/,"    勇敢善战雷神托尔（克里斯•海姆斯沃斯ChrisHemsworth饰），作为永恒境界阿斯加德的王位继承人，受人敬仰。然而由于一次鲁莽的行动，险些挑起一场古老的战争，因此被父亲天神奥丁（安东尼•霍普金斯AnthonyHopkins饰）流放到人间。托尔在人间认识了美丽的女科学家珍•福斯特（娜塔莉•波特曼NataliePortman饰）和她的工作伙伴，在他们的帮助下，托尔找到了和自己一起被贬的雷神之锤，但此时的雷神之锤并不属于他。此间，托尔的弟弟洛基为了成为阿斯加德的王，居然联合寒冰巨人，企图在永恒境界掀起一场腥风血雨。为了维持永恒之界的法度，托尔的四位朋友也来到人间，他们决定带托尔返回永恒之境。此时，为了阻止雷神重归永恒境界，洛基派出巨人杀死托尔。丧失能力和法战的托尔为了保护无辜的人类与自己的朋友，献出了自己的生命。托尔的死打破了天神的...",美国,雷神,7.0,7
ObjectId(5d248a2a7a10db99e1b99413),动作/科幻/奇幻/冒险,https://img3.doubanio.com/view/photo/s_ratio_poster/public/p2552058346.jpg,https://movie.douban.com/subject/26100958/,一声响指，宇宙间半数生命灰飞烟灭。几近绝望的复仇者们在惊奇队长（布丽·拉尔森BrieLarson饰）的帮助下找到灭霸（乔什·布洛林JoshBrolin饰）归隐之处，却得知六颗无限宝石均被销毁，希望彻底破灭。如是过了五年，迷失在量子领域的蚁人（保罗·路德PaulRudd饰）意外回到现实世界，他的出现为幸存的复仇者们点燃了希望。与美国队长（克里斯·埃文斯ChrisEvans饰）冰释前嫌的托尼（小罗伯特·唐尼RobertDowneyJr.饰）找到了穿越时空的方法，星散各地的超级英雄再度集结，他们分别穿越不同的时代去搜集无限宝石。而在这一过程中，平行宇宙的灭霸察觉了他们的计划。    注定要载入史册的最终决战，超级英雄们为了心中恪守的信念前仆后继……,美国,复仇者联盟4：终局之战,8.6,8
ObjectId(5d248a2a7a10db99e1b99415),动作/奇幻/冒险,https://img3.doubanio.com/view/photo/s_ratio_poster/public/p2500451074.jpg,https://movie.douban.com/subject/25821634/,在“索科维亚战役”两年后，雷神索尔（克里斯·海姆斯沃斯ChrisHemsworth饰）识破了洛基（汤姆·希德勒斯顿TomHiddleston饰）的伪装，辗转找到了被放逐到地球的奥丁（安东尼·霍普金斯AnthonyHopkins饰）。然而垂死的奥丁却告知两个儿子，“诸神的黄昏”已经开始，曾遭到奥丁封禁的死亡女神海拉（凯特·布兰切特CateBlanchett饰）即将重返阿斯加德。与海拉的初次对决中，索尔失去了雷神之锤，他和洛基也被打落至混乱不堪的萨卡星。在萨卡的决斗场上，索尔重逢失踪许久的绿巨人，也见到了曾从海拉魔爪下逃得一生的女武神。    历经千辛万苦，索尔和战友们重返阴云密布的阿斯加德，去正视这注定要到来的“诸神的黄昏”……,美国,雷神3：诸神黄昏,7.4,9
ObjectId(5d248a2a7a10db99e1b99417),剧情/运动,https://img3.doubanio.com/view/photo/s_ratio_poster/public/p2556883031.jpg,https://movie.douban.com/subject/27024959/,电影根据体育历史中著名的传奇真实事件改编，讲述了1972年慕尼黑奥运会篮球决赛中，前苏联篮球队打败了保持了36年全胜纪录的美国队的传奇故事。在决赛结束前三秒钟，美国队以一分优势领先。美国队已经开始提前庆祝比赛的胜利了，因为他们相信比赛结果已成定局。然而，一位来自苏联的不知名篮球教练，率领着艰难、困苦、贫穷中的苏联国家队，比赛结果发生逆转，整个篮球历史也发生了改变。,俄罗斯,绝杀慕尼黑,8.3,10
ObjectId(5d248a2a7a10db99e1b99419),动作/科幻/冒险,https://img3.doubanio.com/view/photo/s_ratio_poster/public/p2512123434.jpg,https://movie.douban.com/subject/6390825/,位于非洲的神秘国家瓦坎达，凭借来自宇宙的振金而成为科技极度发达的国家，不过他们长久封闭，始终对外界保守这个秘密。在前国王死于联合国爆炸袭击后，特查拉王子（查德维克·博斯曼ChadwickBoseman饰）继任成为新的国王，同时他也是黑豹的继承者。登基之后，特查拉与前女友娜吉雅（露皮塔·尼永奥LupitaNyongo饰）、贴身侍卫奥姆烨（丹娜·奎里拉DanaiGurira饰）追查曾经盗取振金并杀害瓦坎达人的尤利西斯·克劳（安迪·瑟金斯AndySerkis饰）。一番厮杀后，克劳侥幸逃脱，谁知最终死于合伙人艾瑞克·克尔芒戈（迈克尔·B·乔丹MichaelB.Jordan饰）之手。艾瑞克同样具有瓦坎达血统，而且当年他的父亲死在了自己的兄弟——特查拉父亲的手中。    怀着莫大的仇恨，艾瑞克踏足瓦坎达，去争夺至高无上的王位……,美国/南非/韩国/澳大利亚,黑豹,6.5,11
ObjectId(5d248a2a7a10db99e1b9941b),动作/科幻/冒险,https://img1.doubanio.com/view/photo/s_ratio_poster/public/p1182659238.jpg,https://movie.douban.com/subject/2138838/,上世纪40年代，纳粹及其邪恶轴心的战火烧遍世界各个角落。居住在布鲁克林的小个子史蒂夫·罗格斯（克里斯·埃文斯ChrisEvans饰）心系国家，一心上阵杀敌，可是糟糕的体格让他始终被征兵办拒之门外。偶然的机会，在德籍科学家厄斯金博士（StanleyTucci饰）的帮助下，这个小个子男孩得以走入兵营，并接受了博士的试验，化身成为高大健壮、膂力过人的超级战士。与此同时，德国纳粹红骷髅部队的首领约翰·施密特（雨果·维文HugoWeaving饰）依靠超自然的力量建立起一支超级战队，企图称霸全世界。    为了营救好友，史蒂夫以美国队长的形象闯入施密特的军营，正邪两大超级战士的战斗就此展开……,美国,美国队长,7.0,12
ObjectId(5d248a2a7a10db99e1b9941d),剧情/喜剧/传记,https://img3.doubanio.com/view/photo/s_ratio_poster/public/p2549177902.jpg,https://movie.douban.com/subject/27060077/,托尼（维果·莫腾森ViggoMortensen饰）是一个吊儿郎当游手好闲的混混，在一家夜总会做侍者。这间夜总会因故要停业几个月，可托尼所要支付的房租和生活费不会因此取消，所以他的当务之急是去寻找另一份工作来填补这几个月的空缺。在这个节骨眼上，一位名叫唐雪莉（马赫沙拉·阿里MahershalaAli饰）的黑人钢琴家提出雇佣托尼。    唐雪莉即将开始为期八个星期的南下巡回演出，可是，那个时候南方对黑人的歧视非常的严重，于是托尼便成为了唐雪莉的司机兼保镖。一路上，两人迥异的性格使得他们之间产生了很多的矛盾，与此同时，唐雪莉在南方所遭受的种种不公平的对待也让托尼对种族歧视感到深恶痛绝。,美国,绿皮书,8.9,13
ObjectId(5d248a2a7a10db99e1b9941f),动作/奇幻/冒险,https://img3.doubanio.com/view/photo/s_ratio_poster/public/p2156839164.jpg,https://movie.douban.com/subject/6560058/,"    纽约大战后，雷神索尔（克里斯·海姆斯沃斯ChrisHemsworth饰）将弟弟洛基（汤姆·希德勒斯顿TomHiddleston饰）带回仙宫囚禁起来，此外帮助九大国度平定纷争，威名扶摇直上。虽然父王奥丁（安东尼·霍普金斯AnthonyHopkins饰）劝其及早即位，但索尔念念不忘地球的美丽女孩简·福斯特（娜塔丽·波特曼NataliePortman饰）。与此同时，简在和黛西及其助手伊安调查某个区域时意外被神秘物质入侵，却也因此重逢索尔，并随其返回仙宫。令人意想不到的是，藏在简体内的物质来自远古的黑暗精灵玛勒基斯（克里斯托弗·埃克莱斯顿ChristopherEccleston饰）。在“天体汇聚”的时刻再次到来之际，玛勒基斯企图摧毁九大国度，缔造一个全然黑暗的宇宙。    藏匿简的仙宫受到重创，而索尔和洛基这对冤家兄弟也不得不联手迎战...",美国,雷神2：黑暗世界,7.4,14
ObjectId(5d248a2a7a10db99e1b99421),剧情/动作/犯罪,https://img3.doubanio.com/view/photo/s_ratio_poster/public/p2558294190.jpg,https://movie.douban.com/subject/30175306/,"悍匪龙志强，在香港回归前，趁香港英政府不作为，而屡犯巨案，先后绑架富豪利家及雷家之长子，勒索超过二十亿元，事主怕被报复,交赎款后都不敢报警。中国公安部极为关注，与香港警方合力，派香港警员何天卧底潜入龙志强犯罪团伙，发现他正策划绑架澳门富豪贺不凡，最终陆港警察合力勇擒龙志强，救出贺不凡。",香港/中国大陆,追龙Ⅱ,5.7,15
ObjectId(5d248a2a7a10db99e1b99423),动作/科幻,https://img3.doubanio.com/view/photo/s_ratio_poster/public/p1955027201.jpg,https://movie.douban.com/subject/3231742/,"    自纽约事件以来，托尼·斯塔克（小罗伯特·唐尼RobertDowneyJr.饰）为前所未有的焦虑症所困扰。他疯狂投入钢铁侠升级版的研发，为此废寝忘食，甚至忽略了女友佩珀·波茨（格温妮斯·帕特洛GwynethPaltrow饰）的感受。与此同时，臭名昭著的恐怖头目曼达林（本·金斯利BenKingsley饰）制造了一连串的爆炸袭击事件，托尼当年最忠诚的保镖即在最近的一次袭击中身负重伤。未过多久，托尼、佩珀以及曾与他有过一面之缘的女植物学家玛雅（丽贝卡·豪尔RebeccaHall饰）在家中遭到猛烈的炮火袭击，几乎丧命，而这一切似乎都与22年前那名偶然邂逅的科学家阿尔德里奇·基连（盖·皮尔斯GuyPearce饰）及其终极生物的研究有关。    即使有精密先进的铠甲护身，也无法排遣发自心底的焦虑。被击碎一切的托尼，如何穿越来自地狱的熊熊烈...",美国/中国大陆,钢铁侠3,7.8,16
ObjectId(5d248a2a7a10db99e1b99425),科幻/灾难,https://img3.doubanio.com/view/photo/s_ratio_poster/public/p2545472803.jpg,https://movie.douban.com/subject/26266893/,近未来，科学家们发现太阳急速衰老膨胀，短时间内包括地球在内的整个太阳系都将被太阳所吞没。为了自救，人类提出一个名为“流浪地球”的大胆计划，即倾全球之力在地球表面建造上万座发动机和转向发动机，推动地球离开太阳系，用2500年的时间奔往另外一个栖息之地。中国航天员刘培强（吴京饰）在儿子刘启四岁那年前往国际空间站，和国际同侪肩负起领航者的重任。转眼刘启（屈楚萧饰）长大，他带着妹妹朵朵（赵今麦饰）偷偷跑到地表，偷开外公韩子昂（吴孟达饰）的运输车，结果不仅遭到逮捕，还遭遇了全球发动机停摆的事件。为了修好发动机，阻止地球坠入木星，全球开始展开饱和式营救，连刘启他们的车也被强征加入。在与时间赛跑的过程中，无数的人前仆后继，奋不顾身，只为延续百代子孙生存的希望……    本片根据刘慈欣的同名小说改编。,中国大陆,流浪地球,7.9,17
ObjectId(5d248a2a7a10db99e1b99427),动画/奇幻/冒险,https://img3.doubanio.com/view/photo/s_ratio_poster/public/p2540924496.jpg,https://movie.douban.com/subject/1291560/,小月的母亲生病住院了，父亲带着她与四岁的妹妹小梅到乡间的居住。她们对那里的环境都感到十分新奇，也发现了很多有趣的事情。她们遇到了很多小精灵，她们来到属于她们的环境中，看到了她们世界中很多的奇怪事物，更与一只大大胖胖的龙猫成为了朋友。龙猫与小精灵们利用他们的神奇力量，为小月与妹妹带来了很多神奇的景观，令她们大开眼界。    妹妹小梅常常挂念生病中的母亲，嚷着要姐姐带着她去看母亲，但小月拒绝了。小梅竟然自己前往，不料途中迷路了，小月只好寻找她的龙猫及小精灵朋友们帮助。,日本,龙猫,9.2,18
ObjectId(5d248a2a7a10db99e1b99429),剧情/喜剧,https://img3.doubanio.com/view/photo/s_ratio_poster/public/p2561305376.jpg,https://movie.douban.com/subject/26752088/,普通中年男子程勇（徐峥饰）经营着一家保健品店，失意又失婚。不速之客吕受益（王传君饰）的到来，让他开辟了一条去印度买药做“代购”的新事业，虽然困难重重，但他在这条“买药之路”上发现了商机，一发不可收拾地做起了治疗慢粒白血病的印度仿制药独家代理商。赚钱的同时，他也认识了几个病患及家属，为救女儿被迫做舞女的思慧（谭卓饰）、说一口流利“神父腔”英语的刘牧师（杨新鸣饰），以及脾气暴烈的“黄毛”（章宇饰），几个人合伙做起了生意，利润倍增的同时也危机四伏。程勇昔日的小舅子曹警官（周一围饰）奉命调查仿制药的源头，假药贩子张长林（王砚辉饰）和瑞士正牌医药代表（李乃文饰）也对其虎视眈眈，生意逐渐变成了一场关于救赎的拉锯战。    本片改编自慢粒白血病患者陆勇代购抗癌药的真实事迹。,中国大陆,我不是药神,9.0,19
ObjectId(5d248a2a7a10db99e1b9942b),剧情/家庭,https://img1.doubanio.com/view/photo/s_ratio_poster/public/p2550208359.jpg,https://movie.douban.com/subject/26715636/,影片讲述患难与共的两个家庭因为一场有隐情的意外被迫疏远，他们在时代洪流下历尽伤痛与不安，人生起伏跌宕，最终选择面对真相，坦荡向前的故事。    年轻的刘耀军和沈英明两家人本是挚友，两家儿子沈浩和刘星在郊外嬉戏中，耀军的儿子刘星意外身亡，此事彻底改变了两家人的命运。刘家夫妇远赴南方。多年后，容颜已老的他们再次相聚，隐藏的真相终将因为年轻一代人的坦荡而揭开。岁月流逝，生命滚滚向前……,中国大陆,地久天长,7.9,20
ObjectId(5d248a2a7a10db99e1b9942d),喜剧/动画/冒险,https://img1.doubanio.com/view/photo/s_ratio_poster/public/p2315672647.jpg,https://movie.douban.com/subject/25662329/,故事发生在一个所有哺乳类动物和谐共存的美好世界中，兔子朱迪（金妮弗·古德温GinniferGoodwin配音）从小就梦想着能够成为一名惩恶扬善的刑警，凭借着智慧和努力，朱迪成功的从警校中毕业进入了疯狂动物城警察局，殊不知这里是大型肉食类动物的领地，作为第一只，也是唯一的小型食草类动物，朱迪会遇到怎样的故事呢？    近日里，城中接连发生动物失踪案件，就在全部警员都致力于调查案件真相之时，朱迪却被局长（伊德瑞斯·艾尔巴IdrisElba配音）发配成为了一名无足轻重的交警。某日，正在执勤的兔子遇见了名为尼克（杰森·贝特曼JasonBateman配音）的狐狸，两人不打不相识，之后又误打误撞的接受了寻找失踪的水獭先生的任务，如果不能在两天之内找到水獭先生，朱迪就必须自愿离开警局。朱迪找到了尼克，两人联手揭露了一个隐藏在疯狂动物城之中的惊天秘密。,美国,疯狂动物城,9.2,21
ObjectId(5d248a2a7a10db99e1b9942f),剧情/动作/犯罪,https://img3.doubanio.com/view/photo/s_ratio_poster/public/p511118051.jpg,https://movie.douban.com/subject/1295644/,里昂（让·雷诺饰）是名孤独的职业杀手，受人雇佣。一天，邻居家小姑娘马蒂尔达（纳塔丽·波特曼饰)敲开他的房门，要求在他那里暂避杀身之祸。原来邻居家的主人是警方缉毒组的眼线，只因贪污了一小包毒品而遭恶警（加里·奥德曼饰）杀害全家的惩罚。马蒂尔达得到里昂的留救，幸免于难，并留在里昂那里。里昂教小女孩使枪，她教里昂法文，两人关系日趋亲密，相处融洽。    女孩想着去报仇，反倒被抓，里昂及时赶到，将女孩救回。混杂着哀怨情仇的正邪之战渐次升级，更大的冲突在所难免……,法国,这个杀手不太冷,9.4,22
ObjectId(5d248a2a7a10db99e1b99431),剧情/家庭/传记/运动,https://img3.doubanio.com/view/photo/s_ratio_poster/public/p2457983084.jpg,https://movie.douban.com/subject/26387939/,马哈维亚（阿米尔·汗AamirKhan饰）曾经是一名前途无量的摔跤运动员，在放弃了职业生涯后，他最大的遗憾就是没有能够替国家赢得金牌。马哈维亚将这份希望寄托在了尚未出生的儿子身上，哪知道妻子接连给他生了两个女儿，取名吉塔（法缇玛·萨那·纱卡FatimaSanaShaikh饰）和巴比塔（桑亚·玛荷塔SanyaMalhotra饰）。让马哈维亚没有想到的是，两个姑娘展现出了杰出的摔跤天赋，让他幡然醒悟，就算是女孩，也能够昂首挺胸的站在比赛场上，为了国家和她们自己赢得荣誉。    就这样，在马哈维亚的指导下，吉塔和巴比塔开始了艰苦的训练，两人进步神速，很快就因为在比赛中连连获胜而成为了当地的名人。为了获得更多的机会，吉塔进入了国家体育学院学习，在那里，她将面对更大的诱惑和更多的选择。,印度,摔跤吧！爸爸,9.0,23
